### ISSUE TITLE
Cannot connect to pump.io service on new install

### ISSUE THREAD

**Issue by tcreek** [pump-io/pump.io#1681]
This is from running the command `sudo -u pumpio pump`. No output is appearing after running the command.

As you see, it is listening on port 8080

    node      1189      pumpio   18u  IPv4  12148      0t0  TCP 104.192.169.78:8080 (LISTEN)

This install is located on a physical machine located in a server farm with only a public IP attached to it.
IP tables have port 80, 8080, and 443 open

 Here is the `/etc/pump.io.json` configuration file

```json
{
    "driver":  "mongodb",
    "params": {"host":"localhost","dbname":"pumpio"},
    "hostname":  "freebird.gdn",
    "address": "104.192.169.78",
    "port": 8080,
    "urlPort": 443,
    "secret":  "xxxxxxxxxx",
    "cert":  "/srv/certs/freebird_gdn_cat.crt",
    "key":  "/srv/certs/freebird_server.key",
    "noweb":  false,
    "site":  "Freebird",
    "owner":  "Trent",
    "ownerURL":  "https://www.freebird.gdn/",
    "nologger": false,
    "logfile": "/var/log/pumpio/pumpio.log",
    "serverUser":  "pumpio",
    "datadir": "/srv/pumpio/uploads",
    "debugClient": false,
    "firehose": "ofirehose.com",
    "disableRegistration": true,
    "noCDN": true,
    "requireEmail": false,
    "compress": true,
    "smtpserver": "localhost",
    "proxyWhitelist": ["avatar3.status.net", "avatar.identi.ca", "secure.gravatar.com"],
    "enableUploads": true

}
```

Here is the pump.io log

```json
{"name":"pump.io","hostname":"freebird","pid":1125,"level":30,"msg":"Listening on 8080 for host 104.192.169.78","time":"2018-10-04T21:44:10.685Z","v":0}
{"name":"pump.io","hostname":"freebird","pid":1107,"level":30,"msg":"Listening on 8080 for host 104.192.169.78","time":"2018-10-04T21:44:10.705Z","v":0}
{"name":"pump.io","hostname":"freebird","pid":1133,"level":30,"msg":"Listening on 8080 for host 104.192.169.78","time":"2018-10-04T21:44:10.729Z","v":0}
{"name":"pump.io","hostname":"freebird","pid":1102,"level":30,"msg":"Listening on 8080 for host 104.192.169.78","time":"2018-10-04T21:44:10.730Z","v":0}
{"name":"pump.io","hostname":"freebird","pid":1113,"level":30,"msg":"Listening on 8080 for host 104.192.169.78","time":"2018-10-04T21:44:10.788Z","v":0}
{"name":"pump.io","hostname":"freebird","pid":1127,"level":30,"msg":"Listening on 8080 for host 104.192.169.78","time":"2018-10-04T21:44:10.810Z","v":0}
```

Here is some tcp dump for port 8080 (nothing on port 443):

```
16:49:12.348492 IP dsl-189-156-66-143-dyn.prod-infinitum.com.mx.65390 > freebird.gdn.http-alt: Flags [P.], seq 1:340, ack 1, win 256, length 339: HTTP: GET / HTTP/1.1
16:49:12.348502 IP freebird.gdn.http-alt > dsl-189-156-66-143-dyn.prod-infinitum.com.mx.65390: Flags [.], ack 340, win 237, length 0
16:49:12.348709 IP freebird.gdn.http-alt > dsl-189-156-66-143-dyn.prod-infinitum.com.mx.65390: Flags [F.], seq 1, ack 340, win 237, length 0
16:49:12.420183 IP dsl-189-156-66-143-dyn.prod-infinitum.com.mx.65390 > freebird.gdn.http-alt: Flags [.], ack 2, win 256, length 0
16:49:12.420331 IP dsl-189-156-66-143-dyn.prod-infinitum.com.mx.65390 > freebird.gdn.http-alt: Flags [F.], seq 340, ack 2, win 256, length 0
16:49:12.420347 IP freebird.gdn.http-alt > dsl-189-156-66-143-dyn.prod-infinitum.com.mx.65390: Flags [.], ack 341, win 237, length 0
16:49:12.420780 IP dsl-189-156-66-143-dyn.prod-infinitum.com.mx.65391 > freebird.gdn.http-alt: Flags [S], seq 1849689280, win 64240, options [mss 1452,nop,wscale 8,nop,nop,sackOK], length 0
16:49:12.420793 IP freebird.gdn.http-alt > dsl-189-156-66-143-dyn.prod-infinitum.com.mx.65391: Flags [S.], seq 1153889466, ack 1849689281, win 29200, options [mss 1460,nop,nop,sackOK,nop,wscale 7], length 0
16:49:12.492270 IP dsl-189-156-66-143-dyn.prod-infinitum.com.mx.65391 > freebird.gdn.http-alt: Flags [.], ack 1, win 256, length 0
16:49:12.492770 IP dsl-189-156-66-143-dyn.prod-infinitum.com.mx.65391 > freebird.gdn.http-alt: Flags [P.], seq 1:340, ack 1, win 256, length 339: HTTP: GET / HTTP/1.1
16:49:12.492783 IP freebird.gdn.http-alt > dsl-189-156-66-143-dyn.prod-infinitum.com.mx.65391: Flags [.], ack 340, win 237, length 0
16:49:12.493848 IP freebird.gdn.http-alt > dsl-189-156-66-143-dyn.prod-infinitum.com.mx.65391: Flags [F.], seq 1, ack 340, win 237, length 0
16:49:12.564858 IP dsl-189-156-66-143-dyn.prod-infinitum.com.mx.65391 > freebird.gdn.http-alt: Flags [.], ack 2, win 256, length 0
16:49:12.565608 IP dsl-189-156-66-143-dyn.prod-infinitum.com.mx.65391 > freebird.gdn.http-alt: Flags [F.], seq 340, ack 2, win 256, length 0
16:49:12.565631 IP freebird.gdn.http-alt > dsl-189-156-66-143-dyn.prod-infinitum.com.mx.65391: Flags [.], ack 341, win 237, length 0
16:49:12.565857 IP dsl-189-156-66-143-dyn.prod-infinitum.com.mx.65392 > freebird.gdn.http-alt: Flags [S], seq 3641976925, win 64240, options [mss 1452,nop,wscale 8,nop,nop,sackOK], length 0
16:49:12.565870 IP freebird.gdn.http-alt > dsl-189-156-66-143-dyn.prod-infinitum.com.mx.65392: Flags [S.], seq 950270414, ack 3641976926, win 29200, options [mss 1460,nop,nop,sackOK,nop,wscale 7], length 0
16:49:12.637247 IP dsl-189-156-66-143-dyn.prod-infinitum.com.mx.65392 > freebird.gdn.http-alt: Flags [.], ack 1, win 256, length 0
16:49:12.637994 IP dsl-189-156-66-143-dyn.prod-infinitum.com.mx.65392 > freebird.gdn.http-alt: Flags [P.], seq 1:340, ack 1, win 256, length 339: HTTP: GET / HTTP/1.1
16:49:12.638003 IP freebird.gdn.http-alt > dsl-189-156-66-143-dyn.prod-infinitum.com.mx.65392: Flags [.], ack 340, win 237, length 0
16:49:12.638170 IP freebird.gdn.http-alt > dsl-189-156-66-143-dyn.prod-infinitum.com.mx.65392: Flags [F.], seq 1, ack 340, win 237, length 0
16:49:12.709634 IP dsl-189-156-66-143-dyn.prod-infinitum.com.mx.65392 > freebird.gdn.http-alt: Flags [.], ack 2, win 256, length 0
16:49:12.709736 IP dsl-189-156-66-143-dyn.prod-infinitum.com.mx.65392 > freebird.gdn.http-alt: Flags [F.], seq 340, ack 2, win 256, length 0
16:49:12.709748 IP freebird.gdn.http-alt > dsl-189-156-66-143-dyn.prod-infinitum.com.mx.65392: Flags [.], ack 341, win 237, length 0
```

**Comment by strugee** [comment]
@tcreek I'm having some trouble reading that tcpdump output (I'm just not familiar) but it seems like you're issuing plain HTTP requests? You need to be connecting with HTTPS to port 8080. However note that because `urlPort` is set to 443, you're going to get redirected to that port and then the connection will time out unless you've set up something else on that port. I would suggest removing `urlPort`, testing an HTTPS connection to port 8080, and then reinstating `urlPort` to the config file.

**Comment by tcreek** [comment]
Using https requests. I have removed the urllPort 443 from the pump.io.json file. 

Here again is the tcpdump output for port 8080 using https

```
`21:47:20.505270 IP dsl-189-156-66-143-dyn.prod-infinitum.com.mx.52581 > freebird.gdn.http-alt: Flags [S], seq 4154527875, win 64240, options [mss 1452,nop,wscale 8,nop,nop,sackOK], length 0
21:47:20.505297 IP freebird.gdn.http-alt > dsl-189-156-66-143-dyn.prod-infinitum.com.mx.52581: Flags [S.], seq 20153781, ack 4154527876, win 29200, options [mss 1460,nop,nop,sackOK,nop,wscale 7], length 0
21:47:20.576756 IP dsl-189-156-66-143-dyn.prod-infinitum.com.mx.52581 > freebird.gdn.http-alt: Flags [.], ack 1, win 256, length 0
21:47:20.577555 IP dsl-189-156-66-143-dyn.prod-infinitum.com.mx.52581 > freebird.gdn.http-alt: Flags [P.], seq 1:226, ack 1, win 256, length 225: HTTP
21:47:20.577572 IP freebird.gdn.http-alt > dsl-189-156-66-143-dyn.prod-infinitum.com.mx.52581: Flags [.], ack 226, win 237, length 0
21:47:20.605634 IP freebird.gdn.http-alt > dsl-189-156-66-143-dyn.prod-infinitum.com.mx.52581: Flags [.], seq 1:2905, ack 226, win 237, length 2904: HTTP
21:47:20.605649 IP freebird.gdn.http-alt > dsl-189-156-66-143-dyn.prod-infinitum.com.mx.52581: Flags [.], seq 2905:5809, ack 226, win 237, length 2904: HTTP
21:47:20.605722 IP freebird.gdn.http-alt > dsl-189-156-66-143-dyn.prod-infinitum.com.mx.52581: Flags [P.], seq 5809:6104, ack 226, win 237, length 295: HTTP
21:47:20.677287 IP dsl-189-156-66-143-dyn.prod-infinitum.com.mx.52581 > freebird.gdn.http-alt: Flags [.], ack 2905, win 256, length 0
21:47:20.677539 IP dsl-189-156-66-143-dyn.prod-infinitum.com.mx.52581 > freebird.gdn.http-alt: Flags [.], ack 6104, win 256, length 0
21:47:20.685923 IP dsl-189-156-66-143-dyn.prod-infinitum.com.mx.52581 > freebird.gdn.http-alt: Flags [P.], seq 226:352, ack 6104, win 256, length 126: HTTP
21:47:20.687879 IP freebird.gdn.http-alt > dsl-189-156-66-143-dyn.prod-infinitum.com.mx.52581: Flags [P.], seq 6104:6378, ack 352, win 237, length 274: HTTP
21:47:20.801195 IP dsl-189-156-66-143-dyn.prod-infinitum.com.mx.52581 > freebird.gdn.http-alt: Flags [.], ack 6378, win 255, length 0
21:47:25.967963 IP dsl-189-156-66-143-dyn.prod-infinitum.com.mx.52581 > freebird.gdn.http-alt: Flags [P.], seq 352:383, ack 6378, win 255, length 31: HTTP
21:47:25.968112 IP dsl-189-156-66-143-dyn.prod-infinitum.com.mx.52581 > freebird.gdn.http-alt: Flags [F.], seq 383, ack 6378, win 255, length 0
21:47:25.970098 IP freebird.gdn.http-alt > dsl-189-156-66-143-dyn.prod-infinitum.com.mx.52581: Flags [F.], seq 6378, ack 384, win 237, length 0
21:47:26.041599 IP dsl-189-156-66-143-dyn.prod-infinitum.com.mx.52581 > freebird.gdn.http-alt: Flags [.], ack 6379, win 255, length 0`
```
Still same result in log.

**Comment by strugee** [comment]
https://freebird.gdn:8080/ loads just fine for me?

**Comment by tcreek** [comment]
Yes, this is odd. I just tested with another browser and it is coming up. Just this very browser I cannot connect. Very odd. I tried MS Edge Browser, and Firefox on another machine.

Maybe I need to clear the browser?

**Comment by strugee** [comment]
https://pumpio.readthedocs.io/en/latest/sysadmins-faq.html#i-set-urlport-but-my-browser-is-still-sending-me-to-the-wrong-port

**Comment by tcreek** [comment]
Thank you kindly!

**Comment by strugee** [comment]
Sure. Can I close this issue then?

**Comment by strugee** [comment]
Closing since this seems to be resolved but I'd be happy to reopen if you want.
